{
  "bundleVersion": 1,
  "executionPlan": {
    "dependencies": [],
    "stages": [
      {
        "functionIds": [
          "nf_955824a910df4df5cc32a079555fe109919c41492697d9a1cc507decc5afba20"
        ],
        "index": 0
      }
    ]
  },
  "functions": [
    {
      "definition": {
        "constraints": [
          {
            "kind": "never",
            "output": "approve",
            "predicate": {
              "left": {
                "node": "property",
                "object": {
                  "name": "order",
                  "node": "input"
                },
                "property": "status"
              },
              "node": "binary",
              "operator": "===",
              "right": {
                "node": "literal",
                "value": "fraudulent"
              }
            },
            "source": "order.status === \"fraudulent\""
          },
          {
            "kind": "always",
            "output": "deny",
            "predicate": {
              "left": {
                "node": "property",
                "object": {
                  "name": "order",
                  "node": "input"
                },
                "property": "ageDays"
              },
              "node": "binary",
              "operator": ">",
              "right": {
                "node": "literal",
                "value": 90
              }
            },
            "source": "order.ageDays > 90"
          }
        ],
        "examples": [],
        "template": [
          {
            "kind": "text",
            "text": "Apply our refund policy. Enterprise customers get 60 days; everyone else gets 30. Suspicious circumstances go to review.\nCustomer: "
          },
          {
            "kind": "input",
            "name": "customer"
          },
          {
            "kind": "text",
            "text": "\nOrder: "
          },
          {
            "kind": "input",
            "name": "order"
          },
          {
            "kind": "text",
            "text": "\n"
          }
        ]
      },
      "id": "nf_955824a910df4df5cc32a079555fe109919c41492697d9a1cc507decc5afba20",
      "inputs": [
        {
          "index": 0,
          "name": "customer",
          "tsType": "Customer",
          "type": {
            "fields": [
              {
                "name": "priorRefunds",
                "optional": false,
                "type": {
                  "kind": "number"
                }
              },
              {
                "name": "tier",
                "optional": false,
                "type": {
                  "kind": "union",
                  "variants": [
                    {
                      "kind": "literal",
                      "value": "enterprise"
                    },
                    {
                      "kind": "literal",
                      "value": "standard"
                    }
                  ]
                }
              }
            ],
            "kind": "object",
            "name": "Customer"
          }
        },
        {
          "index": 1,
          "name": "order",
          "tsType": "Order",
          "type": {
            "fields": [
              {
                "name": "ageDays",
                "optional": false,
                "type": {
                  "kind": "number"
                }
              },
              {
                "name": "status",
                "optional": false,
                "type": {
                  "kind": "union",
                  "variants": [
                    {
                      "kind": "literal",
                      "value": "fraudulent"
                    },
                    {
                      "kind": "literal",
                      "value": "paid"
                    }
                  ]
                }
              },
              {
                "name": "total",
                "optional": false,
                "type": {
                  "kind": "number"
                }
              }
            ],
            "kind": "object",
            "name": "Order"
          }
        }
      ],
      "irVersion": 1,
      "kind": "semantscript.neural-function",
      "model": {
        "adapter": "adapter.refund-benchmark",
        "encoder": "encoder.refund-benchmark",
        "heads": [
          {
            "outputPath": "",
            "ref": "head.955824a910df4df5cc32a079555fe109919c41492697d9a1cc507decc5afba20.000"
          }
        ]
      },
      "output": {
        "head": {
          "kind": "nominal",
          "sourceKind": "string-union",
          "support": [
            "approve",
            "deny",
            "review"
          ]
        },
        "kind": "scalar",
        "tsType": "RefundDecision"
      },
      "runtime": {
        "confidenceThreshold": null,
        "fallbackRef": null,
        "resultMode": "diagnostic",
        "synchronous": true
      },
      "semanticSha256": "29b03f7d9ec695eb4178e6c4320b6094f7d1c37bc6bfca3516e983e93a0dc1f1",
      "source": {
        "column": 10,
        "line": 31,
        "path": "refund-with-confidence.sem.ts",
        "sourceSha256": "b5b03d998bae56db7aff5584efdd01277836130a9b7ea1bff1a11fa1a47534eb"
      },
      "stage": "source",
      "trainingProvenance": {
        "status": "pending"
      },
      "verification": {
        "status": "pending"
      }
    }
  ],
  "kind": "semantscript.ir-bundle"
}
